{
  "schema_version": 1,
  "verified_on": "2026-08-03",
  "methodology": {
    "automation_impact": {
      "low": "Read-only analysis or documentation in normal use.",
      "medium": "Can label, comment, fail checks, publish reports, or modify local files.",
      "high": "Can close, lock, delete, block, limit interactions, or change repository settings."
    },
    "important": "Impact describes documented capability, not product quality or maliciousness. Configuration can reduce or increase actual risk."
  },
  "audits": [
    {
      "id": "niubi-guard",
      "repository": "Albert-Weasker/niubi_guard",
      "repo_snapshot": {"archived": false, "pushed_at": "2026-07-16T11:54:05Z", "license_detected": "NOASSERTION"},
      "deployment": "Hosted service, CLI, web UI, Docker, or self-hosted source",
      "default_mode": "Dry-run; strong actions are opt-in",
      "automation_impact": "high",
      "maximum_effects": ["delete comments", "close issues", "lock issues", "block users", "set interaction limits"],
      "data_boundaries": ["GitHub API", "project-configured OpenAI-compatible model", "optional hosted service"],
      "access": "GitHub token; optional model endpoint and API key",
      "limitations": "AI classification is probabilistic. Review evidence and planned actions in dry-run before apply mode. GitHub does not detect the license automatically, but the repository LICENSE file contains Apache-2.0 text.",
      "evidence": [
        "https://github.com/Albert-Weasker/niubi_guard#what-it-does",
        "https://github.com/Albert-Weasker/niubi_guard#ai-detection",
        "https://github.com/Albert-Weasker/niubi_guard/blob/main/LICENSE"
      ]
    },
    {
      "id": "anti-slop",
      "repository": "peakoss/anti-slop",
      "repo_snapshot": {"archived": false, "pushed_at": "2026-04-15T16:37:26Z", "license_detected": "AGPL-3.0"},
      "deployment": "GitHub Action",
      "default_mode": "Enforcement; the documented quick start closes a PR after the failure threshold",
      "automation_impact": "high",
      "maximum_effects": ["label", "comment", "close PR", "lock PR"],
      "data_boundaries": ["GitHub API"],
      "access": "Recommended: contents read, issues read, pull requests write",
      "limitations": "Heuristics include account and contribution-history signals, so legitimate newcomers can be flagged. Set close-pr and lock-pr to false during evaluation.",
      "evidence": [
        "https://github.com/peakoss/anti-slop#quick-start",
        "https://github.com/peakoss/anti-slop#recommended-permissions"
      ]
    },
    {
      "id": "github-ai-moderator",
      "repository": "github/ai-moderator",
      "repo_snapshot": {"archived": false, "pushed_at": "2026-06-02T05:54:42Z", "license_detected": "MIT"},
      "deployment": "GitHub Action",
      "default_mode": "Applies moderation output unless dry-run is enabled",
      "automation_impact": "medium",
      "maximum_effects": ["label", "minimize comment"],
      "data_boundaries": ["GitHub API", "GitHub Models"],
      "access": "GitHub token plus models read and write access needed for configured moderation actions",
      "limitations": "Repository content is sent to a model endpoint and model judgments can be wrong. Its built-in AI-authorship prompt is not proof of authorship; disable it for enforcement. GitHub Models paid usage may apply after free limits.",
      "evidence": [
        "https://github.com/github/ai-moderator#usage",
        "https://github.com/github/ai-moderator#inputs"
      ]
    },
    {
      "id": "ai-community-moderator",
      "repository": "benbalter/ai-community-moderator",
      "repo_snapshot": {"archived": false, "pushed_at": "2025-11-20T02:13:17Z", "license_detected": "MIT"},
      "deployment": "GitHub Action",
      "default_mode": "Model-driven moderation using project guidelines",
      "automation_impact": "high",
      "maximum_effects": ["comment", "hide content", "lock discussion", "limit interactions"],
      "data_boundaries": ["GitHub API", "GitHub Models"],
      "access": "GitHub token, models read, and write permissions for enabled actions",
      "limitations": "A language model interprets community standards; ambiguous or multilingual content needs human review and an appeal path.",
      "evidence": [
        "https://github.com/benbalter/ai-community-moderator#features",
        "https://github.com/benbalter/ai-community-moderator#permissions"
      ]
    },
    {
      "id": "ai-assessment-comment-labeler",
      "repository": "github/ai-assessment-comment-labeler",
      "repo_snapshot": {"archived": false, "pushed_at": "2025-10-16T13:20:30Z", "license_detected": "MIT"},
      "deployment": "GitHub Action",
      "default_mode": "Posts a structured assessment and applies configured labels",
      "automation_impact": "medium",
      "maximum_effects": ["comment", "label"],
      "data_boundaries": ["GitHub API", "GitHub Models or a compatible endpoint"],
      "access": "GitHub token, models read, issues write, and contents read for prompt files",
      "limitations": "The assessment is model-generated, not factual proof. Prompt changes and model changes can alter classification behavior.",
      "evidence": [
        "https://github.com/github/ai-assessment-comment-labeler#overview",
        "https://github.com/github/ai-assessment-comment-labeler#required-permissions"
      ]
    },
    {
      "id": "fossier",
      "repository": "PThorpe92/fossier",
      "repo_snapshot": {"archived": false, "pushed_at": "2026-07-06T16:53:54Z", "license_detected": "MIT"},
      "deployment": "GitHub Action and CLI",
      "default_mode": "Allows, reviews, or denies based on trust tier and a multi-signal score",
      "automation_impact": "high",
      "maximum_effects": ["label", "comment", "close PR"],
      "data_boundaries": ["GitHub API", "optional Fossier registry"],
      "access": "GitHub token with pull-request write access; optional registry API key",
      "limitations": "History-based scoring and optional AI co-author rejection can exclude legitimate contributors. Low-confidence cases are forced to review, but maintainers should still test thresholds.",
      "evidence": [
        "https://github.com/PThorpe92/fossier#how-it-works",
        "https://github.com/PThorpe92/fossier#github-action"
      ]
    },
    {
      "id": "vouch",
      "repository": "mitchellh/vouch",
      "repo_snapshot": {"archived": false, "pushed_at": "2026-07-26T03:12:21Z", "license_detected": "MIT"},
      "deployment": "GitHub Actions and a repository trust file",
      "default_mode": "Explicit admission based on project-defined vouches and denouncements",
      "automation_impact": "high",
      "maximum_effects": ["fail check", "close issue", "lock issue", "close PR"],
      "data_boundaries": ["GitHub API", "repository trust file"],
      "access": "Depends on action; write permission is required for close or lock behavior",
      "limitations": "Explicit trust can protect attention but can also create a closed or biased contributor network. Define transparent nomination and appeal rules.",
      "evidence": [
        "https://github.com/mitchellh/vouch#who-is-vouched",
        "https://github.com/mitchellh/vouch#github-actions"
      ]
    },
    {
      "id": "good-egg",
      "repository": "2ndSetAI/good-egg",
      "repo_snapshot": {"archived": false, "pushed_at": "2026-04-12T17:55:02Z", "license_detected": "MIT"},
      "deployment": "GitHub Action, CLI, Python package, and MCP server",
      "default_mode": "Posts a trust-score comment; fail-on-low is false by default",
      "automation_impact": "medium",
      "maximum_effects": ["comment", "create check", "fail check"],
      "data_boundaries": ["GitHub API", "Python package registry during Action installation"],
      "access": "GitHub token; pull-request write for comments and optional checks write",
      "limitations": "Past merge history is an imperfect proxy for trust and can disadvantage new or private contributors. The Action installs a version-ranged package from PyPI at runtime.",
      "evidence": [
        "https://github.com/2ndSetAI/good-egg#github-action",
        "https://github.com/2ndSetAI/good-egg#scoring-models"
      ]
    },
    {
      "id": "actions-labeler",
      "repository": "actions/labeler",
      "repo_snapshot": {"archived": false, "pushed_at": "2026-07-31T02:54:14Z", "license_detected": "MIT"},
      "deployment": "GitHub Action",
      "default_mode": "Adds or removes labels according to repository configuration",
      "automation_impact": "medium",
      "maximum_effects": ["add label", "remove label"],
      "data_boundaries": ["GitHub API"],
      "access": "Contents read and pull requests write",
      "limitations": "Using pull_request_target is dangerous if the same workflow checks out or executes untrusted PR code. Labeling rules can misroute contributions.",
      "evidence": [
        "https://github.com/actions/labeler#recommended-permissions",
        "https://github.com/actions/labeler#notes-regarding-pull_request_target-event"
      ]
    },
    {
      "id": "actions-stale",
      "repository": "actions/stale",
      "repo_snapshot": {"archived": false, "pushed_at": "2026-07-28T03:14:46Z", "license_detected": "MIT"},
      "deployment": "GitHub Action",
      "default_mode": "Marks inactivity and closes after the configured grace period",
      "automation_impact": "high",
      "maximum_effects": ["label", "comment", "close issue", "close PR", "delete branch"],
      "data_boundaries": ["GitHub API"],
      "access": "Issues and pull requests write; contents write only when deleting branches",
      "limitations": "Inactivity does not mean low value. Exempt security, roadmap, accessibility, and confirmed-bug labels before enabling closure.",
      "evidence": [
        "https://github.com/actions/stale#recommended-permissions",
        "https://github.com/actions/stale#all-options"